{
  "$schema": "http://json-schema.org/draft-07/schema#",
  "type": "object",
  "required": ["basics", "experience", "education", "certifications", "skills"],
  "properties": {
    "basics": {
      "type": "object",
      "required": ["name", "title", "summary", "highlights"],
      "properties": {
        "name": { "type": "string" },
        "contact": {
          "type": "object",
          "properties": {
            "phone": { "type": "string" },
            "email": { "type": "string" },
            "city": { "type": "string" },
            "linkedin": { "type": "string" },
            "github": { "type": "string" }
          }
        },
        "title": { "type": "string" },
        "summary": { "type": "string" },
        "highlights": {
          "type": "array",
          "items": { "type": "string" }
        },
        "keywords": {
          "type": "array",
          "items": { "type": "string" }
        }
      }
    },
    "experience": {
      "type": "array",
      "items": {
        "type": "object",
        "required": ["company", "positions"],
        "properties": {
          "company": { "type": "string" },
          "positions": {
            "type": "array",
            "items": {
              "type": "object",
              "required": ["title", "startDate", "endDate"],
              "properties": {
                "title": { "type": "string" },
                "startDate": { "type": "string", "format": "date" },
                "endDate": { "type": "string", "format": "date" },
                "summary": { "type": "string" },
                "responsibilities": {
                  "type": "array",
                  "items": { "type": "string" }
                },
                "projects": {
                  "type": "array",
                  "items": {
                    "type": "object",
                    "required": ["name"],
                    "properties": {
                      "name": { "type": "string" },
                      "role": { "type": "string" },
                      "responsibilities": { "type": "string" },
                      "technologies": {
                        "type": "array",
                        "items": { "type": "string" }
                      },
                      "challenges": { "type": "string" },
                      "achievements": { "type": "string" },
                      "details": {
                        "type": "array",
                        "items": { "type": "string" }
                      },
                      "keywords": {
                        "type": "array",
                        "items": { "type": "string" }
                      }
                    }
                  }
                },
                "keywords": {
                  "type": "array",
                  "items": { "type": "string" }
                }
              }
            }
          }
        }
      }
    },
    "education": {
      "type": "array",
      "items": {
        "type": "object",
        "required": ["degree", "institution"],
        "properties": {
          "degree": { "type": "string" },
          "institution": { "type": "string" },
          "keywords": {
            "type": "array",
            "items": { "type": "string" }
          }
        }
      }
    },
    "certifications": {
      "type": "array",
      "items": {
        "type": "object",
        "required": ["name"],
        "properties": {
          "name": { "type": "string" },
          "issuer": { "type": "string" },
          "date": { "type": "string", "format": "date" },
          "keywords": {
            "type": "array",
            "items": { "type": "string" }
          }
        }
      }
    },
    "skills": {
      "type": "object",
      "required": ["categories"],
      "properties": {
        "categories": {
          "type": "array",
          "items": {
            "type": "object",
            "required": ["name", "items"],
            "properties": {
              "name": { "type": "string" },
              "items": {
                "type": "array",
                "items": { "type": "string" }
              },
              "keywords": {
                "type": "array",
                "items": { "type": "string" }
              }
            }
          }
        }
      }
    }
  }
}
